{
  "run_id": 5,
  "route_key": "continuous/coverage",
  "exported_at": "2026-04-02T06:45:14.218193Z",
  "series": [
    {
      "name": "step",
      "unit": "steps",
      "aggregation": "snapshot",
      "source": "dispatcher",
      "description": "Dispatcher snapshot series for step",
      "points": [
        {
          "point_index": 0,
          "train_step": 6,
          "episode_index": null,
          "wall_time_sec": 1775112313.998264,
          "value": 6.0,
          "created_at": "2026-04-02T06:45:14"
        },
        {
          "point_index": 1,
          "train_step": 6,
          "episode_index": null,
          "wall_time_sec": 1775112314.081152,
          "value": 6.0,
          "created_at": "2026-04-02T06:45:14"
        }
      ]
    },
    {
      "name": "total_reward",
      "unit": "reward",
      "aggregation": "snapshot",
      "source": "dispatcher",
      "description": "Dispatcher snapshot series for total_reward",
      "points": [
        {
          "point_index": 0,
          "train_step": 6,
          "episode_index": null,
          "wall_time_sec": 1775112314.002327,
          "value": 0.0,
          "created_at": "2026-04-02T06:45:14"
        },
        {
          "point_index": 1,
          "train_step": 6,
          "episode_index": null,
          "wall_time_sec": 1775112314.081152,
          "value": 0.0,
          "created_at": "2026-04-02T06:45:14"
        }
      ]
    },
    {
      "name": "goal_count",
      "unit": "count",
      "aggregation": "snapshot",
      "source": "dispatcher",
      "description": "Dispatcher snapshot series for goal_count",
      "points": [
        {
          "point_index": 0,
          "train_step": 6,
          "episode_index": null,
          "wall_time_sec": 1775112314.0058093,
          "value": 1.0,
          "created_at": "2026-04-02T06:45:14"
        },
        {
          "point_index": 1,
          "train_step": 6,
          "episode_index": null,
          "wall_time_sec": 1775112314.081152,
          "value": 1.0,
          "created_at": "2026-04-02T06:45:14"
        }
      ]
    },
    {
      "name": "collision_count",
      "unit": "count",
      "aggregation": "snapshot",
      "source": "dispatcher",
      "description": "Dispatcher snapshot series for collision_count",
      "points": [
        {
          "point_index": 0,
          "train_step": 6,
          "episode_index": null,
          "wall_time_sec": 1775112314.009805,
          "value": 0.0,
          "created_at": "2026-04-02T06:45:14"
        },
        {
          "point_index": 1,
          "train_step": 6,
          "episode_index": null,
          "wall_time_sec": 1775112314.081152,
          "value": 0.0,
          "created_at": "2026-04-02T06:45:14"
        }
      ]
    },
    {
      "name": "coverage_ratio",
      "unit": "ratio",
      "aggregation": "snapshot",
      "source": "dispatcher",
      "description": "Dispatcher snapshot series for coverage_ratio",
      "points": [
        {
          "point_index": 0,
          "train_step": 6,
          "episode_index": null,
          "wall_time_sec": 1775112314.0128045,
          "value": 0.35714285714285715,
          "created_at": "2026-04-02T06:45:14"
        },
        {
          "point_index": 1,
          "train_step": 6,
          "episode_index": null,
          "wall_time_sec": 1775112314.081152,
          "value": 0.35714285714285715,
          "created_at": "2026-04-02T06:45:14"
        }
      ]
    },
    {
      "name": "missed_area_ratio",
      "unit": "ratio",
      "aggregation": "snapshot",
      "source": "dispatcher",
      "description": "Dispatcher snapshot series for missed_area_ratio",
      "points": [
        {
          "point_index": 0,
          "train_step": 6,
          "episode_index": null,
          "wall_time_sec": 1775112314.01748,
          "value": 0.6428571428571428,
          "created_at": "2026-04-02T06:45:14"
        },
        {
          "point_index": 1,
          "train_step": 6,
          "episode_index": null,
          "wall_time_sec": 1775112314.081152,
          "value": 0.6428571428571428,
          "created_at": "2026-04-02T06:45:14"
        }
      ]
    },
    {
      "name": "return_error",
      "unit": "distance",
      "aggregation": "snapshot",
      "source": "dispatcher",
      "description": "Dispatcher snapshot series for return_error",
      "points": [
        {
          "point_index": 0,
          "train_step": 6,
          "episode_index": null,
          "wall_time_sec": 1775112314.0217566,
          "value": 15.231546211727817,
          "created_at": "2026-04-02T06:45:14"
        },
        {
          "point_index": 1,
          "train_step": 6,
          "episode_index": null,
          "wall_time_sec": 1775112314.081152,
          "value": 15.231546211727817,
          "created_at": "2026-04-02T06:45:14"
        }
      ]
    },
    {
      "name": "path_length",
      "unit": "distance",
      "aggregation": "snapshot",
      "source": "dispatcher",
      "description": "Dispatcher snapshot series for path_length",
      "points": [
        {
          "point_index": 0,
          "train_step": 6,
          "episode_index": null,
          "wall_time_sec": 1775112314.0258038,
          "value": 154.97056274847714,
          "created_at": "2026-04-02T06:45:14"
        },
        {
          "point_index": 1,
          "train_step": 6,
          "episode_index": null,
          "wall_time_sec": 1775112314.081152,
          "value": 154.97056274847714,
          "created_at": "2026-04-02T06:45:14"
        }
      ]
    },
    {
      "name": "task_time_sec",
      "unit": "seconds",
      "aggregation": "snapshot",
      "source": "dispatcher",
      "description": "Dispatcher snapshot series for task_time_sec",
      "points": [
        {
          "point_index": 0,
          "train_step": 6,
          "episode_index": null,
          "wall_time_sec": 1775112314.0283058,
          "value": 0.021170899970456958,
          "created_at": "2026-04-02T06:45:14"
        },
        {
          "point_index": 1,
          "train_step": 6,
          "episode_index": null,
          "wall_time_sec": 1775112314.0821366,
          "value": 0.021170899970456958,
          "created_at": "2026-04-02T06:45:14"
        }
      ]
    },
    {
      "name": "transition_count",
      "unit": "count",
      "aggregation": "snapshot",
      "source": "dispatcher",
      "description": "Dispatcher snapshot series for transition_count",
      "points": [
        {
          "point_index": 0,
          "train_step": 6,
          "episode_index": null,
          "wall_time_sec": 1775112314.031324,
          "value": 0.0,
          "created_at": "2026-04-02T06:45:14"
        },
        {
          "point_index": 1,
          "train_step": 6,
          "episode_index": null,
          "wall_time_sec": 1775112314.0821366,
          "value": 0.0,
          "created_at": "2026-04-02T06:45:14"
        }
      ]
    },
    {
      "name": "repeat_coverage_ratio",
      "unit": "ratio",
      "aggregation": "snapshot",
      "source": "dispatcher",
      "description": "Dispatcher snapshot series for repeat_coverage_ratio",
      "points": [
        {
          "point_index": 0,
          "train_step": 6,
          "episode_index": null,
          "wall_time_sec": 1775112314.0353243,
          "value": 2.380952380952381,
          "created_at": "2026-04-02T06:45:14"
        },
        {
          "point_index": 1,
          "train_step": 6,
          "episode_index": null,
          "wall_time_sec": 1775112314.0821366,
          "value": 2.380952380952381,
          "created_at": "2026-04-02T06:45:14"
        }
      ]
    },
    {
      "name": "angular_work_rad",
      "unit": "radians",
      "aggregation": "snapshot",
      "source": "dispatcher",
      "description": "Dispatcher snapshot series for angular_work_rad",
      "points": [
        {
          "point_index": 0,
          "train_step": 6,
          "episode_index": null,
          "wall_time_sec": 1775112314.0383246,
          "value": 3.141592653589793,
          "created_at": "2026-04-02T06:45:14"
        },
        {
          "point_index": 1,
          "train_step": 6,
          "episode_index": null,
          "wall_time_sec": 1775112314.0821366,
          "value": 3.141592653589793,
          "created_at": "2026-04-02T06:45:14"
        }
      ]
    },
    {
      "name": "compute_time_sec",
      "unit": "seconds",
      "aggregation": "snapshot",
      "source": "dispatcher",
      "description": "Dispatcher snapshot series for compute_time_sec",
      "points": [
        {
          "point_index": 0,
          "train_step": 6,
          "episode_index": null,
          "wall_time_sec": 1775112314.041322,
          "value": 0.01725019991863519,
          "created_at": "2026-04-02T06:45:14"
        },
        {
          "point_index": 1,
          "train_step": 6,
          "episode_index": null,
          "wall_time_sec": 1775112314.0821366,
          "value": 0.01725019991863519,
          "created_at": "2026-04-02T06:45:14"
        }
      ]
    },
    {
      "name": "remaining_rows",
      "unit": "count",
      "aggregation": "snapshot",
      "source": "dispatcher",
      "description": "Dispatcher snapshot series for remaining_rows",
      "points": [
        {
          "point_index": 0,
          "train_step": 6,
          "episode_index": null,
          "wall_time_sec": 1775112314.043331,
          "value": 2.0,
          "created_at": "2026-04-02T06:45:14"
        },
        {
          "point_index": 1,
          "train_step": 6,
          "episode_index": null,
          "wall_time_sec": 1775112314.0821366,
          "value": 2.0,
          "created_at": "2026-04-02T06:45:14"
        }
      ]
    }
  ]
}